{
  "id": "publish-job-local-001",
  "platform": "douyin",
  "video_path": "artifacts/output-video.mp4",
  "title": "电商运营岗招人啦！数据驱动+团队协作，等你来写增长故事",
  "description": "我们正在找电商运营伙伴！\n\n你将负责：\n- 电商平台日常运营与活动策划\n- 数据分析驱动增长策略\n- 跨团队协作推动项目落地\n\n我们提供：\n- 有竞争力的薪资+绩效奖金\n- 扁平化管理，成长空间大\n- 年轻有活力的团队氛围\n\n如果你热爱电商、对数据敏感、享受团队协作的成就感——投简历，来聊聊！",
  "hashtags": [
    "电商运营",
    "招聘",
    "找工作",
    "运营岗",
    "电商招聘",
    "职场",
    "团队"
  ],
  "visibility": "public"
}
