{
  "id": "publish-job-local-001",
  "platform": "douyin",
  "video_path": "artifacts/output-video.mp4",
  "title": "做一个 36 秒的连续短视频，展示 AI 从 brief 生",
  "description": "围绕“做一个 36 秒的连续短视频，展示 AI 从 brief 生成脚本、分镜、视频任务，再准备自动发布到抖音的完整流程”生成一条可编排、可执行、可发布的视频方案。 #AI视频 #抖音自动化 #Seedance",
  "hashtags": [
    "AI视频",
    "抖音自动化",
    "Seedance"
  ],
  "visibility": "public"
}
