{
  "id": "publish-job-local-001",
  "platform": "douyin",
  "video_path": "artifacts/output-video.mp4",
  "title": "AI 帮人自动生成短视频",
  "description": "围绕“AI 帮人自动生成短视频”生成一条可编排、可执行、可发布的视频方案。 #AI视频 #抖音自动化 #Seedance",
  "hashtags": [
    "AI视频",
    "抖音自动化",
    "Seedance"
  ],
  "visibility": "public"
}
