{
  "id": "publish-job-local-001",
  "platform": "douyin",
  "video_path": "artifacts/output-video.mp4",
  "title": "做一条 10 秒角色动作展示视频，主角像数字指挥官一样操控屏",
  "description": "围绕“做一条 10 秒角色动作展示视频，主角像数字指挥官一样操控屏幕中的脚本、分镜和发布流程高速成型”生成一条可编排、可执行、可发布的视频方案。 #AI视频 #抖音自动化 #Seedance",
  "hashtags": [
    "AI视频",
    "抖音自动化",
    "Seedance"
  ],
  "visibility": "public"
}
